{
  "schema_version": "1.0",
  "generated_at": "2026-07-05T00:19:52Z",
  "data_status": "real",
  "evaluation": {
    "method": "holdout",
    "window_days": 30
  },
  "models": [
    {
      "id": "gradientboosting",
      "name": "GradientBoosting",
      "rmse_c": 0.27,
      "mae_c": 0.22,
      "mape_pct": 0.96,
      "ensemble_weight": 0.352,
      "status": "final"
    },
    {
      "id": "lightgbm",
      "name": "LightGBM",
      "rmse_c": 0.32,
      "mae_c": 0.25,
      "mape_pct": 1.06,
      "ensemble_weight": 0.405,
      "status": "final"
    },
    {
      "id": "ensemble_weighted",
      "name": "Ensemble (Weighted)",
      "rmse_c": 0.35,
      "mae_c": 0.28,
      "mape_pct": 1.22,
      "ensemble_weight": null,
      "status": "final"
    },
    {
      "id": "ensemble_simple",
      "name": "Ensemble (Simple Avg)",
      "rmse_c": 0.47,
      "mae_c": 0.38,
      "mape_pct": 1.61,
      "ensemble_weight": null,
      "status": "final"
    },
    {
      "id": "arima",
      "name": "ARIMA(5,1,0)",
      "rmse_c": 0.73,
      "mae_c": 0.57,
      "mape_pct": 2.43,
      "ensemble_weight": 0.124,
      "status": "final"
    },
    {
      "id": "prophet",
      "name": "Prophet (Baseline)",
      "rmse_c": 0.77,
      "mae_c": 0.69,
      "mape_pct": 3.95,
      "ensemble_weight": null,
      "status": "final"
    },
    {
      "id": "sarima",
      "name": "SARIMA(1,1,1)(1,1,1,7)",
      "rmse_c": 0.8,
      "mae_c": 0.61,
      "mape_pct": 2.62,
      "ensemble_weight": 0.119,
      "status": "final"
    }
  ],
  "caveats": []
}
